{
  "meta": {
    "offre_id": "56-01",
    "dossier_id": "56",
    "dossier_folder": "56 - SAS YOGOSHA",
    "fichier_source_pdf": "56_SAS_YOGOSHA_offre1.pdf",
    "extracted_at": "2026-05-15",
    "extracted_by": "claude-agent",
    "confidence": "medium"
  },
  "identification": {
    "cible_raison_sociale": "SAS YOGOSHA",
    "cible_siren": "815035563",
    "naf_secteur": "Cybersécurité / Pentesting / Bug Bounty",
    "sous_secteur": "Plateforme de sécurité offensive (PtaaS, Bug Bounty, VOC)",
    "ca_dernier_exercice_eur": null,
    "ebitda_eur": null,
    "effectif_total": null,
    "nb_sites": 1,
    "type_procedure": "RJ",
    "date_ouverture": "2026-02-27",
    "dldo": "2026-04-01",
    "date_audience_cession": null,
    "aj_nom": "Me Maxime Lebreton",
    "aj_etude": "SELARL AJASSOCIES",
    "mj_nom": "Me Frédérique Lévy",
    "mj_etude": "SELAFA MJA",
    "juge_commissaire": null,
    "causes_defaillance": null
  },
  "issue_dossier": {
    "cette_offre_retenue": "en_attente",
    "issue_globale_dossier": "en_attente",
    "motifs_tribunal_verbatim": null,
    "motifs_rejet_verbatim": null,
    "nb_offres_concurrentes": 2,
    "concurrents_resume": [
      {"nom": "CREATIVE INVEST 2025 (Groupe Créative + TechLife Capital)", "positionnement_2lignes": "Offre formelle 25 000€, ESN régionale CA 30M€, expansion cybersécurité"}
    ]
  },
  "profil_repreneur": {
    "forme": "societe_existante_industriel",
    "age_parcours_dirigeant": "Eric COHEN (Président Keyrus, fondateur 1995). Conseil cybersécurité international (Opsky France, Axon Dubaï)",
    "experience_sectorielle_oui_non": "oui",
    "experience_sectorielle_annees": null,
    "track_record_reprises": [],
    "capacite_financiere_demontree": "forte_documentee",
    "cautionnement_personnel": "NR",
    "vehicule_reprise": {
      "forme_juridique": "Société dédiée à constituer, détenue à 100% par Groupe Keyrus",
      "date_creation": null,
      "capital_eur": 4319467.50,
      "rcs": "400149647",
      "kbis_present_en_annexe": true,
      "type_vehicule": "substitution_prevue"
    }
  },
  "structure_prix": {
    "prix_total_eur": null,
    "decomposition": {
      "incorporels_eur": null,
      "corporels_eur": null,
      "stocks_eur": null,
      "creances_clients_eur": null,
      "immeubles_eur": null,
      "titres_eur": null
    },
    "charges_augmentatives_eur": null,
    "modalites_paiement": "NR",
    "garanties_paiement": "Fonds propres du Groupe (pas de financement externe envisagé)",
    "cheque_consignation_eur": null
  },
  "reprise_passif": {
    "baux_repris": [],
    "credit_bail_repris": [],
    "contrats_clients_critiques_repris": [],
    "contrats_fournisseurs_repris": [],
    "engagements_L642_12_al4": false,
    "engagement_L642_12_montant_eur": null,
    "passif_privilegie_repris": null,
    "retraites_chapeau_indemnites": null
  },
  "volet_social": {
    "nb_salaries_repris": null,
    "nb_total_salaries": null,
    "pct_reprise": null,
    "categories_reprises": "À préciser à l'issue de l'audit",
    "categories_non_reprises_raisons": null,
    "maintien_conditions_anciennete_salaire_lieu": "NR",
    "plan_licenciement": {
      "nb": null,
      "calendrier": null,
      "indemnites": null,
      "accompagnement": null
    },
    "engagement_maintien_emplois_duree_mois": null,
    "sanction_non_respect_emplois": null,
    "relations_irp_cse_mention": false
  },
  "plan_industriel": {
    "diagnostic_qualification": "operationnel",
    "diagnostic_resume": "Logique industrielle : développement pôle cybersécurité du Groupe via synergies cross-business (PtaaS + Bug Bounty + Opsky MicroSOC + Offensive Security). Solution Yogosha déjà testée et validée par Directeur Technique Keyrus.",
    "vision_strategique_phrase": "Manifestation d'intérêt portant sur tout ou partie des actifs et de l'activité de Yogosha",
    "pivots_prevus": "Redéveloppement Moyen-Orient via filiale Axon Dubaï",
    "synergies_repreneur": "Opsky (France) + Axon (Dubaï) + données/IA Keyrus",
    "synergies_chiffrees_eur": null,
    "capex_montant_eur": null,
    "capex_calendrier": null,
    "capex_nature": null,
    "plan_affaires_3ans_present": false,
    "ca_an1_eur": null,
    "ca_an2_eur": null,
    "ca_an3_eur": null,
    "ebitda_an3_eur": null,
    "hypotheses_qualification": "absentes",
    "maintien_site": "NR",
    "maintien_marques_savoir_faire": "oui"
  },
  "financement": {
    "apport_fonds_propres_eur": null,
    "apport_origine_documentee": "oui_simple_mention",
    "dette_bancaire_engagement_ferme": false,
    "dette_bancaire_lettre_confort": false,
    "dette_bancaire_montant_eur": 0,
    "credit_bail_repris_oui_non": false,
    "affacturage_dailly": false,
    "bfr_redemarrage_eur": null,
    "tresorerie_securite_eur": null,
    "partenaires_financiers": []
  },
  "engagements_specifiques": {
    "incessibilite_temporaire_mois": null,
    "caution_dirigeant_montant_eur": null,
    "caution_dirigeant_duree_mois": null,
    "penalites_non_respect_social_eur": null,
    "maintien_territoire_site_duree": null,
    "non_demembrement": false
  },
  "conditions_suspensives": {
    "aucune_cs": false,
    "nb_conditions": 1,
    "items": ["Audit financier/commercial/juridique/industriel concluant (non mené dans les délais imposés par le calendrier judiciaire)"],
    "agressivite_envers_dirigeants": "aucune"
  },
  "forme_presentation": {
    "nb_pages_total": null,
    "nb_pages_corps_offre": null,
    "nb_pages_annexes": null,
    "structure_dominante": "lettre_simple",
    "ton_dominant": "commercial",
    "executive_summary_present": false,
    "annexes_kbis": true,
    "annexes_cv_dirigeants": false,
    "annexes_attest_bancaire": false,
    "annexes_lettres_soutien_clients": false,
    "annexes_lettres_soutien_collectivites": false,
    "annexes_business_plan": false,
    "annexes_organigramme_cible": false,
    "annexes_comptes_sociaux_3ans": true,
    "annexes_attest_fisc_sociale": false,
    "annexes_rib": false,
    "annexes_cni_dirigeants": false,
    "signature_docusign": false,
    "qualite_redactionnelle": "claire"
  },
  "signaux_faibles": {
    "soutien_collectivite_locale": false,
    "soutien_clients_cles": false,
    "soutien_banques_historiques": false,
    "personnalisation_visite_site": false,
    "personnalisation_rencontre_equipes": false,
    "personnalisation_etude_contrats": false,
    "coherence_prix_BP": "NR",
    "differenciation_concurrents_explicite": false,
    "elements_emotionnels_sociaux": false,
    "erreurs_apparentes": ["LOI sans prix chiffré déposée à 7 jours de la DLDO — signal faible : intérêt déclaratif uniquement, pas de proposition concrète"],
    "declaration_L642_3_signee": false,
    "faculte_substitution_precise": true
  },
  "avocat_repreneur": {
    "cabinet": null,
    "avocat_nom": null
  },
  "extraits_remarquables": {
    "phrase_positionnement": "Logique industrielle : développement pôle cybersécurité du Groupe via synergies cross-business",
    "phrase_engagement_social": null,
    "phrase_vision_strategique": "Solution Yogosha déjà testée et validée par Directeur Technique Keyrus",
    "phrase_justification_prix": null
  }
}
