{
  "meta": {"offre_id": "45-15", "dossier_id": "45", "dossier_folder": "45 - SAS associé unique COLLEGE DE PARIS", "fichier_source_pdf": "45_SAS___associ__unique_COLLEGE_DE_PARIS_offre15.pdf", "extracted_at": "2026-05-15", "extracted_by": "claude-agent", "confidence": "low"},
  "identification": {"cible_raison_sociale": "COLLEGE DE PARIS — large périmètre", "cible_siren": "815229901", "naf_secteur": "Enseignement supérieur", "sous_secteur": "Ascencia BS + 3 campus + E2SE + ECEMA + ELFE + COMUNDI + associations IFOCOP/IRFA/AE2SE", "ca_dernier_exercice_eur": 178000000, "ebitda_eur": null, "effectif_total": 1390, "nb_sites": 76, "type_procedure": "RJ", "date_ouverture": "2026-03-16", "dldo": "2026-04-10", "date_audience_cession": null, "aj_nom": "Sandra BELADJINE", "aj_etude": "SELARL BCM", "mj_nom": "Stéphane GORRIAS", "mj_etude": "SCP BTSG", "juge_commissaire": "Pascal CAGNA", "causes_defaillance": "CDP holding"},
  "issue_dossier": {"cette_offre_retenue": "en_attente", "issue_globale_dossier": "en_attente", "motifs_tribunal_verbatim": null, "motifs_rejet_verbatim": null, "nb_offres_concurrentes": 25, "concurrents_resume": []},
  "profil_repreneur": {"forme": "fonds_pe", "age_parcours_dirigeant": "Sacha ULLMANN-HAMON Prés / Vincent FAHMY DG. Groupe VERDOSO Industries — fonds investissement situations spéciales/distressed.", "experience_sectorielle_oui_non": "partielle", "experience_sectorielle_annees": null, "track_record_reprises": ["Fonds spécialisé situations spéciales"], "capacite_financiere_demontree": "forte_documentee", "cautionnement_personnel": "NR", "vehicule_reprise": {"forme_juridique": "SAS VERDOSO Industries", "date_creation": null, "capital_eur": 3249428, "rcs": "789095999", "kbis_present_en_annexe": false, "type_vehicule": "existante"}},
  "structure_prix": {"prix_total_eur": 11, "decomposition": {"incorporels_eur": null, "corporels_eur": null, "stocks_eur": null, "creances_clients_eur": null, "immeubles_eur": null, "titres_eur": null}, "charges_augmentatives_eur": null, "modalites_paiement": "NR", "garanties_paiement": null, "cheque_consignation_eur": null},
  "reprise_passif": {"baux_repris": [], "credit_bail_repris": [], "contrats_clients_critiques_repris": [], "contrats_fournisseurs_repris": [], "engagements_L642_12_al4": false, "engagement_L642_12_montant_eur": null, "passif_privilegie_repris": null, "retraites_chapeau_indemnites": null},
  "volet_social": {"nb_salaries_repris": 55, "nb_total_salaries": 1390, "pct_reprise": 4, "categories_reprises": "50 CDI + 5 contrats apprentissage", "categories_non_reprises_raisons": "Large périmètre mais social très limité", "maintien_conditions_anciennete_salaire_lieu": "NR", "plan_licenciement": {"nb": null, "calendrier": null, "indemnites": null, "accompagnement": null}, "engagement_maintien_emplois_duree_mois": null, "sanction_non_respect_emplois": null, "relations_irp_cse_mention": false},
  "plan_industriel": {"diagnostic_qualification": "NR", "diagnostic_resume": "PDF non lu — prix 11€ symbolique pour large périmètre (signal faible valeur résiduelle)", "vision_strategique_phrase": null, "pivots_prevus": null, "synergies_repreneur": "Fonds distressed VERDOSO", "synergies_chiffrees_eur": null, "capex_montant_eur": null, "capex_calendrier": null, "capex_nature": null, "plan_affaires_3ans_present": false, "ca_an1_eur": null, "ca_an2_eur": null, "ca_an3_eur": null, "ebitda_an3_eur": null, "hypotheses_qualification": "NR", "maintien_site": "partiel", "maintien_marques_savoir_faire": "NR"},
  "financement": {"apport_fonds_propres_eur": null, "apport_origine_documentee": "oui_simple_mention", "dette_bancaire_engagement_ferme": false, "dette_bancaire_lettre_confort": false, "dette_bancaire_montant_eur": null, "credit_bail_repris_oui_non": false, "affacturage_dailly": false, "bfr_redemarrage_eur": null, "tresorerie_securite_eur": null, "partenaires_financiers": ["Fonds propres VERDOSO"]},
  "engagements_specifiques": {"incessibilite_temporaire_mois": null, "caution_dirigeant_montant_eur": null, "caution_dirigeant_duree_mois": null, "penalites_non_respect_social_eur": null, "maintien_territoire_site_duree": null, "non_demembrement": false},
  "conditions_suspensives": {"aucune_cs": false, "nb_conditions": null, "items": [], "agressivite_envers_dirigeants": "NR"},
  "forme_presentation": {"nb_pages_total": null, "nb_pages_corps_offre": null, "nb_pages_annexes": null, "structure_dominante": "NR", "ton_dominant": "NR", "executive_summary_present": false, "annexes_kbis": false, "annexes_cv_dirigeants": false, "annexes_attest_bancaire": false, "annexes_lettres_soutien_clients": false, "annexes_lettres_soutien_collectivites": false, "annexes_business_plan": false, "annexes_organigramme_cible": false, "annexes_comptes_sociaux_3ans": false, "annexes_attest_fisc_sociale": false, "annexes_rib": false, "annexes_cni_dirigeants": false, "signature_docusign": false, "qualite_redactionnelle": "NR"},
  "signaux_faibles": {"soutien_collectivite_locale": false, "soutien_clients_cles": false, "soutien_banques_historiques": false, "personnalisation_visite_site": false, "personnalisation_rencontre_equipes": false, "personnalisation_etude_contrats": false, "coherence_prix_BP": "NR", "differenciation_concurrents_explicite": false, "elements_emotionnels_sociaux": false, "erreurs_apparentes": ["Prix 11€ symbolique = pattern Minelli cherry-picking", "PDF non lu"], "declaration_L642_3_signee": false, "faculte_substitution_precise": false},
  "avocat_repreneur": {"cabinet": null, "avocat_nom": null},
  "extraits_remarquables": {"phrase_positionnement": "VERDOSO Industries — fonds investissement situations spéciales/distressed", "phrase_engagement_social": "50 CDI + 5 contrats apprentissage repris", "phrase_vision_strategique": null, "phrase_justification_prix": "11 € symbolique pour large périmètre"}
}
