{
  "meta": {"offre_id": "45-22", "dossier_id": "45", "dossier_folder": "45 - SAS associé unique COLLEGE DE PARIS", "fichier_source_pdf": "45_SAS___associ__unique_COLLEGE_DE_PARIS_offre22.pdf", "extracted_at": "2026-05-15", "extracted_by": "claude-agent", "confidence": "medium"},
  "identification": {"cible_raison_sociale": "COLLEGE DE PARIS — cession partielle ECEMA Valence", "cible_siren": "815229901", "naf_secteur": "Enseignement supérieur", "sous_secteur": "ECEMA Valence (2000 actions = 50%)", "ca_dernier_exercice_eur": 178000000, "ebitda_eur": null, "effectif_total": 1390, "nb_sites": 76, "type_procedure": "RJ", "date_ouverture": "2026-03-16", "dldo": "2026-04-10", "date_audience_cession": null, "aj_nom": "Sandra BELADJINE", "aj_etude": "SELARL BCM", "mj_nom": "Stéphane GORRIAS", "mj_etude": "SCP BTSG", "juge_commissaire": "Pascal CAGNA", "causes_defaillance": "ECEMA Valence dans CDP"},
  "issue_dossier": {"cette_offre_retenue": "en_attente", "issue_globale_dossier": "en_attente", "motifs_tribunal_verbatim": null, "motifs_rejet_verbatim": null, "nb_offres_concurrentes": 25, "concurrents_resume": []},
  "profil_repreneur": {"forme": "dirigeant_historique", "age_parcours_dirigeant": "Alexis MIRONNEAU Gérant (né 07/05/1985 Villeurbanne, 40 ans). Ingénieur informatique EM Lyon + Centrale Lyon. Créateur ECEMA Valence en 2018 (8 ans), 14 ans entrepreneuriat. Aussi gérant PMP Consulting (45-14) et impliqué NEXT STEP.", "experience_sectorielle_oui_non": "oui", "experience_sectorielle_annees": 14, "track_record_reprises": ["Création ECEMA Valence 2018"], "capacite_financiere_demontree": "moyenne_documentee", "cautionnement_personnel": "NR", "vehicule_reprise": {"forme_juridique": "SARL/EURL OCEA Invest + faculté substitution", "date_creation": "2022", "capital_eur": 751000, "rcs": "914781695", "kbis_present_en_annexe": false, "type_vehicule": "existante"}},
  "structure_prix": {"prix_total_eur": 60000, "decomposition": {"incorporels_eur": 50000, "corporels_eur": 0, "stocks_eur": null, "creances_clients_eur": 10000, "immeubles_eur": null, "titres_eur": 50000}, "charges_augmentatives_eur": 10000, "modalites_paiement": "comptant_audience", "garanties_paiement": "Caution bancaire ou chèque banque 60.000€ aux mandataires judiciaires", "cheque_consignation_eur": 60000},
  "reprise_passif": {"baux_repris": [], "credit_bail_repris": [], "contrats_clients_critiques_repris": [], "contrats_fournisseurs_repris": [], "engagements_L642_12_al4": false, "engagement_L642_12_montant_eur": null, "passif_privilegie_repris": "Rachat créances CDP envers ECEMA Valence et filiales (10.000€ forfaitaire)", "retraites_chapeau_indemnites": null},
  "volet_social": {"nb_salaries_repris": 0, "nb_total_salaries": 1390, "pct_reprise": 0, "categories_reprises": "Aucun (cession titres)", "categories_non_reprises_raisons": "Cession titres", "maintien_conditions_anciennete_salaire_lieu": "NR", "plan_licenciement": {"nb": null, "calendrier": null, "indemnites": null, "accompagnement": null}, "engagement_maintien_emplois_duree_mois": null, "sanction_non_respect_emplois": null, "relations_irp_cse_mention": false},
  "plan_industriel": {"diagnostic_qualification": "operationnel", "diagnostic_resume": "OCEA Invest holding 2022 fondée par MIRONNEAU. 10 salariés OCEA + filiales. Pacte associés ECEMA Valence 30/11/2018 CDP-OCEA. Objectif 500 apprentis bassin valentinois moyen terme.", "vision_strategique_phrase": "Montée à 100% ECEMA Valence par fondateur historique", "pivots_prevus": "Démission Présidence ECEMA Valence par CDP avant entrée jouissance", "synergies_repreneur": "Pacte associés 2018", "synergies_chiffrees_eur": null, "capex_montant_eur": null, "capex_calendrier": null, "capex_nature": null, "plan_affaires_3ans_present": true, "ca_an1_eur": 121528, "ca_an2_eur": null, "ca_an3_eur": null, "ebitda_an3_eur": 326754, "hypotheses_qualification": "prudentes", "maintien_site": "oui_total", "maintien_marques_savoir_faire": "oui"},
  "financement": {"apport_fonds_propres_eur": 1049203, "apport_origine_documentee": "oui_rib_attestation", "dette_bancaire_engagement_ferme": false, "dette_bancaire_lettre_confort": false, "dette_bancaire_montant_eur": null, "credit_bail_repris_oui_non": false, "affacturage_dailly": false, "bfr_redemarrage_eur": null, "tresorerie_securite_eur": null, "partenaires_financiers": ["Fonds propres OCEA Invest (CP 1.049k€)", "Emprunt bancaire en discussion"]},
  "engagements_specifiques": {"incessibilite_temporaire_mois": null, "caution_dirigeant_montant_eur": null, "caution_dirigeant_duree_mois": null, "penalites_non_respect_social_eur": null, "maintien_territoire_site_duree": null, "non_demembrement": false},
  "conditions_suspensives": {"aucune_cs": false, "nb_conditions": 3, "items": ["Accord juge-commissaire pour rachat créances CDP 10.000€", "Confirmation absence transfert charge sûreté L.642-12 al.4", "Notification ordonnance juge-commissaire L.622-7"], "agressivite_envers_dirigeants": "aucune"},
  "forme_presentation": {"nb_pages_total": null, "nb_pages_corps_offre": null, "nb_pages_annexes": null, "structure_dominante": "sommaire_detaille", "ton_dominant": "juridique", "executive_summary_present": false, "annexes_kbis": false, "annexes_cv_dirigeants": true, "annexes_attest_bancaire": true, "annexes_lettres_soutien_clients": false, "annexes_lettres_soutien_collectivites": false, "annexes_business_plan": false, "annexes_organigramme_cible": false, "annexes_comptes_sociaux_3ans": true, "annexes_attest_fisc_sociale": false, "annexes_rib": false, "annexes_cni_dirigeants": false, "signature_docusign": false, "qualite_redactionnelle": "claire"},
  "signaux_faibles": {"soutien_collectivite_locale": true, "soutien_clients_cles": false, "soutien_banques_historiques": false, "personnalisation_visite_site": true, "personnalisation_rencontre_equipes": true, "personnalisation_etude_contrats": true, "coherence_prix_BP": "coherent", "differenciation_concurrents_explicite": true, "elements_emotionnels_sociaux": true, "erreurs_apparentes": [], "declaration_L642_3_signee": false, "faculte_substitution_precise": true},
  "avocat_repreneur": {"cabinet": null, "avocat_nom": null},
  "extraits_remarquables": {"phrase_positionnement": "OCEA Invest — holding personnelle Alexis MIRONNEAU créateur ECEMA Valence 2018", "phrase_engagement_social": "Aucun salarié repris (cession titres)", "phrase_vision_strategique": "Objectif 500 apprentis bassin valentinois moyen terme", "phrase_justification_prix": "60.000 € — 50k titres + 10k rachat créances CDP"}
}
